### ISSUE TITLE
CircleCI test results showing slow tests in CI

### ISSUE THREAD

**Issue by yschimke** [square/okhttp#4784]
Slow test results for https://circleci.com/gh/square/okhttp/38#tests/containers/0

> Your job ran 2345 tests in junit with 0 failures
> Slowest test: okhttp3.EventListenerTest requestBodyFailHttp2OverHttps (took 95.48 seconds).

Saw it slow on another branch also

**Comment by amirlivneh** [comment]
I run some time measurements in Travis. In orcalejdk8 and opendk8 flavors, this line takes ~1 ms to execute when HTTP/1.1 is used and ~240 ms (!) in the HTTP/2 case:
https://github.com/square/okhttp/blob/aab224769a3bdac1dcc7bd0b3a9c6b39f9d510eb/okhttp/src/test/java/okhttp3/EventListenerTest.java#L975

With openjdk11 it executes relatively quickly for both protocols.

**Comment by amirlivneh** [comment]
Another difference between HTTP/1.1 and HTTP/2 is that with HTTP/1.1, this reads almost always exactly 8192 bytes:
https://github.com/square/okhttp/blob/8059408457ef1d845f5b7e8c519e509ea97027a5/mockwebserver/src/main/java/okhttp3/mockwebserver/MockWebServer.java#L829

With HTTP/2, I see a pattern where it quickly reads a bit less, e.g. 8190 and then reads the remaining bytes, e.g. 2 bytes. That second read takes a significant time, which causes the overall slowness.

**Comment by yschimke** [comment]
IS that in a loop? It's a long way from 40ms to 95 seconds.

**Comment by yschimke** [comment]
@amirlivneh CircleCI should build branches in square/okhttp and also all PRs regardless of where they started.  No need to land in master and revert.

**Comment by amirlivneh** [comment]
It was unintentional. I had a mixup with my remotes. Sorry about that.

**Comment by yschimke** [comment]
Don't worry, mainly an FYI in case there was a storm of those coming :)

**Comment by amirlivneh** [comment]
The slowness observed in the test may be a real issue.

While sending the 256 MB request, the client often suspends writing for periods of 40 ms and waits for a WINDOW_UPDATE frame here:
https://github.com/square/okhttp/blob/66ce79306b151fc1e7cc51bb8a79af15dd8d3e8f/okhttp/src/main/java/okhttp3/internal/http2/Http2Stream.java#L554
This happens many times during the test and adds up to a significant time.

It appears to be related to Nagle's algorithm. Setting `setTcpNoDelay()` on the raw socket in `RealConnetion.connectSocket()` reduces run time from ~80 to ~5 seconds.

**Comment by swankjesse** [comment]
We're missing a flush() somewhere?

**Comment by amirlivneh** [comment]
I'm not aware of a way to force Nagle's algorithm to send the data immediately, other than maybe temporarily disabling it.

Note the 40 ms stalls where one of the endpoints waits for an ACK. It looks like a bad interaction between Nagle's algorithm and delayed ACK. 38255 is the server port here:
```
07:06:51.637067 IP localhost.46762 > localhost.38255: Flags [P.], seq 28619348:28619388, ack 73526, win 63, options [nop,nop,TS val 590920783 ecr 590920783], length 40
07:06:51.637506 IP localhost.38255 > localhost.46762: Flags [P.], seq 73526:73568, ack 28619388, win 2944, options [nop,nop,TS val 590920783 ecr 590920783], length 42
07:06:51.637524 IP localhost.46762 > localhost.38255: Flags [P.], seq 28619388:28635868, ack 73568, win 63, options [nop,nop,TS val 590920783 ecr 590920783], length 16480
07:06:51.637587 IP localhost.38255 > localhost.46762: Flags [P.], seq 73568:73610, ack 28635868, win 2935, options [nop,nop,TS val 590920783 ecr 590920783], length 42
07:06:51.637678 IP localhost.46762 > localhost.38255: Flags [P.], seq 28635868:28644089, ack 73610, win 63, options [nop,nop,TS val 590920783 ecr 590920783], length 8221
07:06:51.677747 IP localhost.38255 > localhost.46762: Flags [.], ack 28644089, win 2944, options [nop,nop,TS val 590920824 ecr 590920783], length 0
07:06:51.677773 IP localhost.46762 > localhost.38255: Flags [P.], seq 28644089:28685307, ack 73610, win 63, options [nop,nop,TS val 590920824 ecr 590920824], length 41218
07:06:51.678411 IP localhost.38255 > localhost.46762: Flags [P.], seq 73610:73652, ack 28685307, win 2923, options [nop,nop,TS val 590920824 ecr 590920824], length 42
07:06:51.718804 IP localhost.46762 > localhost.38255: Flags [.], ack 73652, win 63, options [nop,nop,TS val 590920865 ecr 590920824], length 0
07:06:51.718822 IP localhost.38255 > localhost.46762: Flags [P.], seq 73652:73778, ack 28685307, win 2944, options [nop,nop,TS val 590920865 ecr 590920865], length 126
07:06:51.718964 IP localhost.46762 > localhost.38255: Flags [.], ack 73778, win 63, options [nop,nop,TS val 590920865 ecr 590920865], length 0
07:06:51.719005 IP localhost.46762 > localhost.38255: Flags [P.], seq 28685307:28685346, ack 73778, win 63, options [nop,nop,TS val 590920865 ecr 590920865], length 39
07:06:51.720632 IP localhost.46762 > localhost.38255: Flags [.], seq 28685346:28750829, ack 73778, win 63, options [nop,nop,TS val 590920866 ecr 590920865], length 65483
07:06:51.720742 IP localhost.38255 > localhost.46762: Flags [.], ack 28750829, win 2911, options [nop,nop,TS val 590920867 ecr 590920865], length 0
07:06:51.720770 IP localhost.46762 > localhost.38255: Flags [P.], seq 28750829:28751226, ack 73778, win 63, options [nop,nop,TS val 590920867 ecr 590920867], length 397
07:06:51.721780 IP localhost.38255 > localhost.46762: Flags [P.], seq 73778:73820, ack 28751226, win 2911, options [nop,nop,TS val 590920868 ecr 590920867], length 42
07:06:51.762787 IP localhost.46762 > localhost.38255: Flags [.], ack 73820, win 63, options [nop,nop,TS val 590920909 ecr 590920868], length 0
07:06:51.762825 IP localhost.38255 > localhost.46762: Flags [P.], seq 73820:73862, ack 28751226, win 2944, options [nop,nop,TS val 590920909 ecr 590920909], length 42
07:06:51.762925 IP localhost.46762 > localhost.38255: Flags [.], ack 73862, win 63, options [nop,nop,TS val 590920909 ecr 590920909], length 0
07:06:51.763095 IP localhost.46762 > localhost.38255: Flags [P.], seq 28751226:28751266, ack 73862, win 63, options [nop,nop,TS val 590920909 ecr 590920909], length 40
07:06:51.763400 IP localhost.38255 > localhost.46762: Flags [P.], seq 73862:73904, ack 28751266, win 2944, options [nop,nop,TS val 590920909 ecr 590920909], length 42
07:06:51.763416 IP localhost.46762 > localhost.38255: Flags [P.], seq 28751266:28751304, ack 73904, win 63, options [nop,nop,TS val 590920909 ecr 590920909], length 38
07:06:51.763459 IP localhost.38255 > localhost.46762: Flags [P.], seq 73904:73946, ack 28751304, win 2944, options [nop,nop,TS val 590920909 ecr 590920909], length 42
07:06:51.763504 IP localhost.46762 > localhost.38255: Flags [P.], seq 28751304:28759525, ack 73946, win 63, options [nop,nop,TS val 590920909 ecr 590920909], length 8221
07:06:51.803777 IP localhost.38255 > localhost.46762: Flags [.], ack 28759525, win 2944, options [nop,nop,TS val 590920950 ecr 590920909], length 0
07:06:51.803822 IP localhost.46762 > localhost.38255: Flags [P.], seq 28759525:28817185, ack 73946, win 63, options [nop,nop,TS val 590920950 ecr 590920950], length 57660
07:06:51.804772 IP localhost.38255 > localhost.46762: Flags [P.], seq 73946:73988, ack 28817185, win 2915, options [nop,nop,TS val 590920951 ecr 590920950], length 42
07:06:51.845747 IP localhost.46762 > localhost.38255: Flags [.], ack 73988, win 63, options [nop,nop,TS val 590920992 ecr 590920951], length 0
07:06:51.845764 IP localhost.38255 > localhost.46762: Flags [P.], seq 73988:74114, ack 28817185, win 2944, options [nop,nop,TS val 590920992 ecr 590920992], length 126
07:06:51.845906 IP localhost.46762 > localhost.38255: Flags [.], ack 74114, win 63, options [nop,nop,TS val 590920992 ecr 590920992], length 0
07:06:51.845947 IP localhost.46762 > localhost.38255: Flags [P.], seq 28817185:28817224, ack 74114, win 63, options [nop,nop,TS val 590920992 ecr 590920992], length 39
```

Compare to a case where `setTcpNoDelay(true)` is called on the client socket. 57431 is the server socket:
```
07:01:15.454068 IP localhost.57248 > localhost.57431: Flags [P.], seq 134733474:134741695, ack 343920, win 63, options [nop,nop,TS val 590584600 ecr 590584600], length 8221
07:01:15.454194 IP localhost.57431 > localhost.57248: Flags [P.], seq 343920:343962, ack 134741695, win 1280, options [nop,nop,TS val 590584600 ecr 590584600], length 42
07:01:15.454264 IP localhost.57248 > localhost.57431: Flags [P.], seq 134741695:134749914, ack 343962, win 63, options [nop,nop,TS val 590584600 ecr 590584600], length 8219
07:01:15.454276 IP localhost.57431 > localhost.57248: Flags [P.], seq 343962:344004, ack 134749914, win 1276, options [nop,nop,TS val 590584600 ecr 590584600], length 42
07:01:15.454300 IP localhost.57248 > localhost.57431: Flags [P.], seq 134749914:134749954, ack 344004, win 63, options [nop,nop,TS val 590584600 ecr 590584600], length 40
07:01:15.454481 IP localhost.57248 > localhost.57431: Flags [P.], seq 134749954:134758175, ack 344004, win 63, options [nop,nop,TS val 590584600 ecr 590584600], length 8221
07:01:15.454515 IP localhost.57431 > localhost.57248: Flags [.], ack 134758175, win 1275, options [nop,nop,TS val 590584600 ecr 590584600], length 0
07:01:15.454673 IP localhost.57248 > localhost.57431: Flags [P.], seq 134758175:134766394, ack 344004, win 63, options [nop,nop,TS val 590584600 ecr 590584600], length 8219
07:01:15.454691 IP localhost.57248 > localhost.57431: Flags [P.], seq 134766394:134766433, ack 344004, win 63, options [nop,nop,TS val 590584600 ecr 590584600], length 39
07:01:15.454720 IP localhost.57431 > localhost.57248: Flags [.], ack 134766433, win 1275, options [nop,nop,TS val 590584600 ecr 590584600], length 0
07:01:15.454755 IP localhost.57248 > localhost.57431: Flags [P.], seq 134766433:134766472, ack 344004, win 63, options [nop,nop,TS val 590584601 ecr 590584600], length 39
07:01:15.454919 IP localhost.57248 > localhost.57431: Flags [P.], seq 134766472:134766510, ack 344004, win 63, options [nop,nop,TS val 590584601 ecr 590584600], length 38
07:01:15.454938 IP localhost.57431 > localhost.57248: Flags [.], ack 134766510, win 1280, options [nop,nop,TS val 590584601 ecr 590584601], length 0
07:01:15.455040 IP localhost.57431 > localhost.57248: Flags [P.], seq 344004:344046, ack 134766510, win 1280, options [nop,nop,TS val 590584601 ecr 590584601], length 42
07:01:15.455111 IP localhost.57248 > localhost.57431: Flags [P.], seq 134766510:134774731, ack 344046, win 63, options [nop,nop,TS val 590584601 ecr 590584601], length 8221
07:01:15.455124 IP localhost.57431 > localhost.57248: Flags [P.], seq 344046:344088, ack 134774731, win 1276, options [nop,nop,TS val 590584601 ecr 590584601], length 42
07:01:15.455321 IP localhost.57248 > localhost.57431: Flags [P.], seq 134774731:134782952, ack 344088, win 63, options [nop,nop,TS val 590584601 ecr 590584601], length 8221
07:01:15.455341 IP localhost.57248 > localhost.57431: Flags [P.], seq 134782952:134782990, ack 344088, win 63, options [nop,nop,TS val 590584601 ecr 590584601], length 38
07:01:15.455355 IP localhost.57431 > localhost.57248: Flags [.], ack 134782990, win 1275, options [nop,nop,TS val 590584601 ecr 590584601], length 0
```
